{
  "$schema": "https://json-schema.org/draft/2020-12/schema",
  "title": "Astra Content Hub V2 manifest",
  "type": "object",
  "properties": {
    "schemaVersion": {
      "const": 2
    },
    "id": {
      "type": "string",
      "maxLength": 100,
      "pattern": "^[a-z][a-z0-9]*(?:[.-][a-z0-9]+)+$"
    },
    "version": {
      "type": "string",
      "pattern": "^(0|[1-9]\\d*)\\.(0|[1-9]\\d*)\\.(0|[1-9]\\d*)$"
    },
    "displayName": {
      "type": "string",
      "minLength": 1
    },
    "description": {
      "type": "string",
      "minLength": 1
    },
    "category": {
      "type": "string",
      "minLength": 1
    },
    "tags": {
      "type": "array",
      "items": {
        "type": "string",
        "minLength": 1
      }
    },
    "compatibility": {
      "type": "object",
      "properties": {
        "minimumUnity": {
          "type": "string",
          "pattern": "^\\d+\\.\\d+\\.\\d+[abfp]\\d+$"
        },
        "maximumUnityExclusive": {
          "type": "string",
          "pattern": "^\\d+\\.\\d+\\.\\d+[abfp]\\d+$"
        },
        "testedUnity": {
          "type": "array",
          "items": {
            "type": "string",
            "pattern": "^\\d+\\.\\d+\\.\\d+[abfp]\\d+$"
          },
          "minItems": 1
        },
        "renderPipelines": {
          "type": "array",
          "items": {
            "type": "string",
            "minLength": 1
          }
        },
        "platforms": {
          "type": "array",
          "items": {
            "type": "string",
            "minLength": 1
          }
        }
      },
      "required": [
        "minimumUnity",
        "maximumUnityExclusive",
        "testedUnity",
        "renderPipelines",
        "platforms"
      ],
      "additionalProperties": false
    },
    "contentDependencies": {
      "type": "array",
      "items": {
        "type": "object",
        "properties": {
          "id": {
            "type": "string",
            "maxLength": 100,
            "pattern": "^[a-z][a-z0-9]*(?:[.-][a-z0-9]+)+$"
          },
          "minimumVersion": {
            "type": "string",
            "pattern": "^(0|[1-9]\\d*)\\.(0|[1-9]\\d*)\\.(0|[1-9]\\d*)$"
          },
          "maximumVersionExclusive": {
            "anyOf": [
              {
                "type": "string",
                "pattern": "^(0|[1-9]\\d*)\\.(0|[1-9]\\d*)\\.(0|[1-9]\\d*)$"
              },
              {
                "const": ""
              }
            ]
          }
        },
        "required": [
          "id",
          "minimumVersion",
          "maximumVersionExclusive"
        ],
        "additionalProperties": false
      },
      "description": "Half-open version ranges [minimumVersion, maximumVersionExclusive). An empty maximumVersionExclusive means no upper bound."
    },
    "projectPrerequisites": {
      "type": "array",
      "items": {
        "type": "object",
        "properties": {
          "kind": {
            "enum": [
              "package",
              "assembly",
              "capability"
            ]
          },
          "name": {
            "type": "string",
            "minLength": 1
          },
          "minimumVersion": {
            "anyOf": [
              {
                "type": "string",
                "pattern": "^(0|[1-9]\\d*)\\.(0|[1-9]\\d*)\\.(0|[1-9]\\d*)$"
              },
              {
                "const": ""
              }
            ]
          },
          "maximumVersionExclusive": {
            "anyOf": [
              {
                "type": "string",
                "pattern": "^(0|[1-9]\\d*)\\.(0|[1-9]\\d*)\\.(0|[1-9]\\d*)$"
              },
              {
                "const": ""
              }
            ]
          }
        },
        "required": [
          "kind",
          "name",
          "minimumVersion",
          "maximumVersionExclusive"
        ],
        "additionalProperties": false
      }
    },
    "containsCode": {
      "type": "boolean"
    },
    "license": {
      "type": "string",
      "minLength": 1
    },
    "attribution": {
      "type": "string"
    },
    "sources": {
      "type": "array",
      "items": {
        "type": "string"
      }
    },
    "releaseNotes": {
      "type": "string"
    },
    "archive": {
      "type": "object",
      "properties": {
        "url": {
          "type": "string",
          "format": "uri",
          "pattern": "^https://"
        },
        "sha256": {
          "type": "string",
          "pattern": "^[a-f0-9]{64}$"
        },
        "bytes": {
          "type": "integer",
          "minimum": 1,
          "maximum": 2147483647
        },
        "expandedBytes": {
          "type": "integer",
          "minimum": 1,
          "maximum": 8589934592
        },
        "fileCount": {
          "type": "integer",
          "minimum": 1,
          "maximum": 100000
        }
      },
      "required": [
        "url",
        "sha256",
        "bytes",
        "expandedBytes",
        "fileCount"
      ],
      "additionalProperties": false
    }
  },
  "required": [
    "schemaVersion",
    "id",
    "version",
    "displayName",
    "description",
    "category",
    "tags",
    "compatibility",
    "contentDependencies",
    "projectPrerequisites",
    "containsCode",
    "license",
    "attribution",
    "sources",
    "releaseNotes",
    "archive"
  ],
  "additionalProperties": false
}
