{
    "schemaVersion": 2,
    "id": "astra.template.tactics",
    "version": "2.1.0",
    "displayName": "Tactics Template",
    "description": "Three-chapter tactical RPG starter with preparation, combat, objectives and campaign saves.",
    "category": "Templates",
    "tags": [
        "tactics",
        "grid",
        "turn-based"
    ],
    "compatibility": {
        "minimumUnity": "6000.4.0f1",
        "maximumUnityExclusive": "6000.5.0a1",
        "testedUnity": [
            "6000.4.0f1"
        ],
        "renderPipelines": [
            "urp"
        ],
        "platforms": [
            "StandaloneOSX"
        ]
    },
    "contentDependencies": [
        {
            "id": "astra.tactics",
            "minimumVersion": "2.1.0",
            "maximumVersionExclusive": "3.0.0"
        }
    ],
    "projectPrerequisites": [
        {
            "kind": "capability",
            "name": "input-system-enabled",
            "minimumVersion": "",
            "maximumVersionExclusive": ""
        },
        {
            "kind": "capability",
            "name": "astra-framework",
            "minimumVersion": "2.1.0",
            "maximumVersionExclusive": "3.0.0"
        },
        {
            "kind": "package",
            "name": "com.unity.inputsystem",
            "minimumVersion": "1.19.0",
            "maximumVersionExclusive": "2.0.0"
        },
        {
            "kind": "package",
            "name": "com.unity.render-pipelines.universal",
            "minimumVersion": "17.4.0",
            "maximumVersionExclusive": "18.0.0"
        },
        {
            "kind": "package",
            "name": "com.unity.ugui",
            "minimumVersion": "2.0.0",
            "maximumVersionExclusive": "3.0.0"
        },
        {
            "kind": "assembly",
            "name": "Astra.Framework.Game.FlowPresentation.Runtime",
            "minimumVersion": "",
            "maximumVersionExclusive": ""
        },
        {
            "kind": "assembly",
            "name": "Astra.Framework.Core.UI.Runtime",
            "minimumVersion": "",
            "maximumVersionExclusive": ""
        },
        {
            "kind": "assembly",
            "name": "Astra.Framework.Game.HUD.Runtime",
            "minimumVersion": "",
            "maximumVersionExclusive": ""
        }
    ],
    "containsCode": false,
    "license": "MIT",
    "attribution": "Copyright (c) 2026 Alexis Gomes. Contenu sous licence MIT ; aucun asset tiers.",
    "sources": [],
    "releaseNotes": "2.1.0: chapters authored as text (Chapters/*.txt, read by the builder) and edited in Tactics Studio; chapter names and objectives are label keys of Localization/tactics-en; player units are deploy slots; Aegis rule assets and TacticsPlaytestSettings for the studio Play button. Requires astra.tactics 2.1.0.",
    "archive": {
        "url": "https://github.com/MisterPxl/astra-content/releases/download/template-tactics-v2.1.0/astra.template.tactics-2.1.0.zip",
        "sha256": "a5f6004e597b065ce54b49fa59ad8ef1e0047a1674b57de8721c2170e477e287",
        "bytes": 332057,
        "expandedBytes": 1929813,
        "fileCount": 399
    }
}
