{
    "schemaVersion": 2,
    "id": "astra.grass",
    "version": "0.2.3",
    "displayName": "Astra Grass",
    "description": "Herbe stylis\u00e9e en touffes pour URP : peinture au pinceau, color shading, vent, interacteurs avec trails, correction de perspective et rendu GPU indirect optimis\u00e9.",
    "category": "Environment",
    "tags": [
        "grass",
        "vegetation",
        "urp",
        "environment",
        "gpu"
    ],
    "compatibility": {
        "minimumUnity": "6000.4.0f1",
        "maximumUnityExclusive": "6000.4.0f2",
        "testedUnity": [
            "6000.4.0f1"
        ],
        "renderPipelines": [
            "urp"
        ],
        "platforms": [
            "StandaloneOSX",
            "Android",
            "iOS"
        ]
    },
    "contentDependencies": [
        {
            "id": "astra.shaders.core",
            "minimumVersion": "0.1.2",
            "maximumVersionExclusive": "0.2.0"
        }
    ],
    "projectPrerequisites": [
        {
            "kind": "package",
            "name": "com.unity.inputsystem",
            "minimumVersion": "1.19.0",
            "maximumVersionExclusive": ""
        },
        {
            "kind": "package",
            "name": "com.unity.render-pipelines.universal",
            "minimumVersion": "17.4.0",
            "maximumVersionExclusive": ""
        },
        {
            "kind": "package",
            "name": "com.unity.modules.physics",
            "minimumVersion": "1.0.0",
            "maximumVersionExclusive": ""
        }
    ],
    "containsCode": true,
    "license": "MIT",
    "attribution": "Copyright (c) 2026 Alexis Gomes. Code et contenu de d\u00e9monstration Astra sous licence MIT. Voir LICENSES/LICENSE.txt.",
    "sources": [],
    "releaseNotes": "0.2.3 : contrat Content Hub V2 : d\u00e9pendances par plages de versions, aucun changement de contenu. D\u00e9pend de astra.shaders.core [0.1.2, 0.2.0). Requiert le framework \u00e0 partir du tag framework-game-2026-10-19 (Core : framework-core-2026-10-19) ; un Hub plus ancien ne lit pas le catalogue gameplay-v26. 0.2.2 : d\u00e9pendance d\u00e9plac\u00e9e sur astra.shaders.core 0.1.1, aucun autre changement. 0.2.1 : rendu corrig\u00e9 et all\u00e9g\u00e9. Les buffers des touffes visibles grandissent quand on peint au-del\u00e0 de leur capacit\u00e9 (avant, le shader \u00e9crivait hors limites). Plus aucune allocation par cam\u00e9ra et par image : buffers d'interacteurs persistants, plans de frustum r\u00e9utilis\u00e9s, s\u00e9lection des interacteurs les plus proches sans tri complet ni copie (GrassInteractionSystem.SelectNearest remplit une liste fournie, l'ancienne surcharge renvoyant un tableau est retir\u00e9e). La carte des traces n'avance qu'une fois par image, depuis la premi\u00e8re cam\u00e9ra de jeu : la vue Scene ouverte en m\u00eame temps ne double plus la d\u00e9croissance. Seules les cam\u00e9ras de jeu et la vue Scene dessinent l'herbe ; les cam\u00e9ras d\u00e9truites lib\u00e8rent leurs buffers. 0.2.0 : les passes ShadowCaster, DepthOnly et une nouvelle passe DepthNormals utilisent les fragments de astra.shaders.core ; l'ombre des brins re\u00e7oit le biais de normale et le clamp du plan proche d'URP, et DepthOnly \u00e9crit la profondeur au lieu de rien. La sc\u00e8ne de d\u00e9mo Meadow.unity est r\u00e9g\u00e9n\u00e9r\u00e9e : en 0.1.2 elle n'avait ni profil d'herbe ni profil de qualit\u00e9, et aucune herbe n'\u00e9tait dessin\u00e9e. Build Feature Meadow remplace MeadowFieldData.asset au lieu d'en cr\u00e9er une copie \u00e0 chaque reconstruction. D\u00e9pend de astra.shaders.core 0.1.0. 0.1.2 : Menus de l'\u00e9diteur corrig\u00e9s pour un pack install\u00e9 par le Hub : le dossier du pack est trouv\u00e9 l\u00e0 o\u00f9 il est install\u00e9 (Assets/AstraContent/astra.grass) au lieu du chemin fixe Assets/_Project/Features/Grass, les shaders compute sont bien r\u00e9f\u00e9renc\u00e9s et rien n'est plus \u00e9crit dans le pack install\u00e9. Create Grass Field et Build Feature Meadow cr\u00e9ent leurs assets sous Assets/GrassGenerated, Create Meadow Demo sous Assets/GrassMeadowDemo.",
    "archive": {
        "url": "https://github.com/MisterPxl/astra-content/releases/download/grass-v0.2.3/astra.grass-0.2.3.zip",
        "sha256": "a14caa0bc07ced518ef48bd957b8fa6fc6fe7d7334ce1583f5bf67afbb35916c",
        "bytes": 141191,
        "expandedBytes": 370023,
        "fileCount": 103
    }
}
