{
    "schemaVersion": 2,
    "id": "astra.ariadne",
    "version": "1.0.1",
    "displayName": "Ariadne - UI Poolable Collections",
    "description": "Collections UGUI virtualis\u00e9es : listes verticales, listes horizontales et grilles, cellules recycl\u00e9es par pool, tailles variables, items pleine largeur et sources de donn\u00e9es sectionn\u00e9es.",
    "category": "UI",
    "tags": [
        "ui",
        "ugui",
        "collection",
        "list",
        "grid",
        "pooling",
        "virtualization"
    ],
    "compatibility": {
        "minimumUnity": "6000.0.0f1",
        "maximumUnityExclusive": "7000.0.0a1",
        "testedUnity": [
            "6000.4.0f1"
        ],
        "renderPipelines": [],
        "platforms": []
    },
    "contentDependencies": [],
    "projectPrerequisites": [
        {
            "kind": "package",
            "name": "com.unity.ugui",
            "minimumVersion": "2.0.0",
            "maximumVersionExclusive": ""
        }
    ],
    "containsCode": true,
    "license": "MIT",
    "attribution": "Copyright (c) 2026 Alexis Gomes. Code et d\u00e9mos Astra sous licence MIT. Voir LICENSES/LICENSE.txt.",
    "sources": [],
    "releaseNotes": "1.0.1 : contrat Content Hub V2 : d\u00e9pendances par plages de versions, aucun changement de contenu. Requiert le framework \u00e0 partir du tag framework-game-2026-10-19 (Core : framework-core-2026-10-19) ; un Hub plus ancien ne lit pas le catalogue gameplay-v26. 1.0.0 : Premi\u00e8re publication : collections UGUI virtualis\u00e9es avec pool de cellules, trois dispositions (verticale, horizontale, grille), tailles d'item variables, items pleine largeur, mappage d'index et sources sectionn\u00e9es. D\u00e9mos incluses sous Demo/.",
    "archive": {
        "url": "https://github.com/MisterPxl/astra-content/releases/download/ariadne-v1.0.1/astra.ariadne-1.0.1.zip",
        "sha256": "320a16234cfd7eb97652a08070447b96a6abef795028f83c9935211d044f039a",
        "bytes": 50703,
        "expandedBytes": 95619,
        "fileCount": 96
    }
}
