{
    "schemaVersion": 2,
    "id": "astra.tactics",
    "version": "1.0.0",
    "displayName": "Tactics",
    "description": "Deterministic square-grid tactical RPG simulation, Unity authoring and Astra integration.",
    "category": "Gameplay",
    "tags": [
        "tactics",
        "grid",
        "turn-based"
    ],
    "compatibility": {
        "minimumUnity": "6000.4.0f1",
        "maximumUnityExclusive": "6000.5.0a1",
        "testedUnity": [
            "6000.4.0f1"
        ],
        "renderPipelines": [
            "urp"
        ],
        "platforms": [
            "StandaloneOSX"
        ]
    },
    "contentDependencies": [],
    "projectPrerequisites": [
        {
            "kind": "capability",
            "name": "input-system-enabled",
            "minimumVersion": "",
            "maximumVersionExclusive": ""
        },
        {
            "kind": "capability",
            "name": "astra-framework",
            "minimumVersion": "2.1.0",
            "maximumVersionExclusive": "3.0.0"
        },
        {
            "kind": "package",
            "name": "com.unity.inputsystem",
            "minimumVersion": "1.19.0",
            "maximumVersionExclusive": "2.0.0"
        },
        {
            "kind": "package",
            "name": "com.unity.ugui",
            "minimumVersion": "2.0.0",
            "maximumVersionExclusive": "3.0.0"
        },
        {
            "kind": "package",
            "name": "com.misterpxl.valkyrie",
            "minimumVersion": "2.1.0",
            "maximumVersionExclusive": "3.0.0"
        },
        {
            "kind": "assembly",
            "name": "Astra.Framework.Core.UI.Runtime",
            "minimumVersion": "",
            "maximumVersionExclusive": ""
        },
        {
            "kind": "assembly",
            "name": "Astra.Framework.Game.Flow.Runtime",
            "minimumVersion": "",
            "maximumVersionExclusive": ""
        },
        {
            "kind": "assembly",
            "name": "Astra.Framework.Core.Localization.Runtime",
            "minimumVersion": "",
            "maximumVersionExclusive": ""
        },
        {
            "kind": "assembly",
            "name": "Astra.Framework.Game.HUD.Runtime",
            "minimumVersion": "",
            "maximumVersionExclusive": ""
        },
        {
            "kind": "assembly",
            "name": "Astra.Framework.Game.FlowPresentation.Runtime",
            "minimumVersion": "",
            "maximumVersionExclusive": ""
        }
    ],
    "containsCode": true,
    "license": "MIT",
    "attribution": "Copyright (c) 2026 Alexis Gomes. Code sous licence MIT.",
    "sources": [],
    "releaseNotes": "1.0.0: deterministic tactics Core, asset compilers, map editor, standalone demo, three-chapter Astra campaign, preparation, HUD, AI and suspend/Continue.",
    "archive": {
        "url": "https://github.com/MisterPxl/astra-content/releases/download/tactics-v1.0.0/astra.tactics-1.0.0.zip",
        "sha256": "096c6e932bc222a0904713fc0629f7819e56f6823ea5def7b9750bbda8d11c36",
        "bytes": 141222,
        "expandedBytes": 320698,
        "fileCount": 208
    }
}