{
    "schemaVersion": 2,
    "id": "astra.template.deckbuilder",
    "version": "3.0.1",
    "displayName": "Deckbuilder Template",
    "description": "Template roguelite deckbuilder pr\u00eat \u00e0 jouer : carte de run, combat au tour, sauvegarde et menu Continuer, sans code auteur.",
    "category": "Templates",
    "tags": [
        "template",
        "deckbuilder",
        "cards",
        "roguelite",
        "turn-based",
        "mobile",
        "touch"
    ],
    "compatibility": {
        "minimumUnity": "6000.4.0f1",
        "maximumUnityExclusive": "6000.4.0f2",
        "testedUnity": [
            "6000.4.0f1"
        ],
        "renderPipelines": [
            "urp"
        ],
        "platforms": [
            "StandaloneOSX",
            "Android",
            "iOS"
        ]
    },
    "contentDependencies": [
        {
            "id": "astra.deckbuilder",
            "minimumVersion": "3.0.1",
            "maximumVersionExclusive": "4.0.0"
        }
    ],
    "projectPrerequisites": [
        {
            "kind": "capability",
            "name": "input-system-enabled",
            "minimumVersion": "",
            "maximumVersionExclusive": ""
        },
        {
            "kind": "package",
            "name": "com.unity.inputsystem",
            "minimumVersion": "1.19.0",
            "maximumVersionExclusive": "1.19.1"
        },
        {
            "kind": "package",
            "name": "com.unity.render-pipelines.universal",
            "minimumVersion": "17.4.0",
            "maximumVersionExclusive": "17.4.1"
        },
        {
            "kind": "package",
            "name": "com.unity.ugui",
            "minimumVersion": "2.0.0",
            "maximumVersionExclusive": "2.0.1"
        },
        {
            "kind": "assembly",
            "name": "Astra.Framework.Game.FlowPresentation.Runtime",
            "minimumVersion": "",
            "maximumVersionExclusive": ""
        }
    ],
    "containsCode": false,
    "license": "MIT",
    "attribution": "Copyright (c) 2026 Alexis Gomes. Contenu sous licence MIT ; aucun asset tiers.",
    "sources": [],
    "releaseNotes": "3.0.1 : contrat Content Hub V2 : d\u00e9pendances par plages de versions, aucun changement de contenu. D\u00e9pend de astra.deckbuilder [3.0.1, 4.0.0). Requiert le framework \u00e0 partir du tag framework-game-2026-10-19 (Core : framework-core-2026-10-19) ; un Hub plus ancien ne lit pas le catalogue gameplay-v26. 3.0.0 : requiert astra.deckbuilder 3.0.0. Six types de n\u0153ud (combat, boutique, repos, boss, \u00e9lite, \u00e9v\u00e9nement), deux \u00e9v\u00e9nements (sanctuaire, forge), un ennemi Colosse et un groupe de rencontres d'\u00e9lite ; recettes \u00ab Ajouter un type de n\u0153ud sans code (\u00e9lite) \u00bb et \u00ab Ajouter un type de n\u0153ud interactif (\u00e9v\u00e9nement) \u00bb, section \u00ab Passer de la 2.x \u00e0 la 3.0 \u00bb (RunConfig.Node Kinds remplace les types du module, sauvegardes de run en version 2). 2.0.0 : requiert astra.deckbuilder 2.0.0. Le HUD (points de vie, jauge, or, \u00e9tage) est fait d'\u00e9l\u00e9ments de HUD g\u00e9n\u00e9riques lisant Config/Hud/DeckbuilderHudValues.asset ; guides : recette \u00ab Ajouter un \u00e9l\u00e9ment de HUD sans code \u00bb et section \u00ab Passer de la 1.x \u00e0 la 2.0 \u00bb (une variante du HUD 1.x est \u00e0 refaire). 1.1.0 : requiert astra.deckbuilder 1.1.0 ; RunConfig expose Shop Rules et Rest Rules, MaxEnergy et DrawPerTurn du personnage sont pris en compte, guide mis \u00e0 jour (ordre des statuts, limites lev\u00e9es). HUD typ\u00e9 via astra.deckbuilder 1.1.0. Requiert le framework Game \u00e0 partir du tag framework-game-2026-10-15 (HUD typ\u00e9) ; sur un framework plus ancien, l'import ne compile pas. 1.0.0 : template G5 deckbuilder (carte, combat, sauvegarde de run), composition par identifiants de module (astra.core.localization, deckbuilder.module). Requiert le framework Game Flow Foundation (Game.FlowPresentation).",
    "archive": {
        "url": "https://github.com/MisterPxl/astra-content/releases/download/template-deckbuilder-v3.0.1/astra.template.deckbuilder-3.0.1.zip",
        "sha256": "6eb4d2e6bd73c4ad1ef843fed0880c84870bfcb55143438d97cbc4910d403f2b",
        "bytes": 158743,
        "expandedBytes": 704966,
        "fileCount": 173
    }
}
